{
  "reference_id": "692e8acc-d1d9-45dc-b50f-e7b824f3306f",
  "status": "Success",
  "reservation": {
    "reservation_id": "XXX123",
    "partner_reference": "abc123",
    "status": "Booked",
    "confirmation_url": "https://www.partner-hotel.com/confirm/XXX123",
    "checkin_date": "2016-01-25",
    "checkout_date": "2016-01-26",
    "hotel": {
      "name": "Some Awesome Hotel",
      "address1": "52977 Ismael Bridge",
      "city": "South Maurice",
      "state": "NY",
      "postal_code": "01234",
      "country": "USA",
      "latitude": -61.7414,
      "longitude": -174.122,
      "phone": "(509) 711-6896",
      "url": "http://www.hotel-site.com/welcome",
      "amenities": [
        "RESTAURANT",
        "NON_SMOKING",
        "FREE_PARKING"
      ],
      "checkinout_policy": "check-in from 3pm and check-out till 12am"
    },
    "customer": {
      "first_name": "Christopher",
      "last_name": "Palmer",
      "phone_number": "9-(590)311-9256",
      "email": "john@doe.com",
      "country": "US"
    },
    "rooms": [
      {
        "party": {
          "adults": 2,
          "children": [
            1
          ]
        },
        "traveler_first_name": "Christopher",
        "traveler_last_name": "Palmer"
      }
    ],
    "legal_text": "some legal stuff for confirmation",
    "comments": "special comment for confirmation",
    "receipt": {
      "line_items": [
        {
          "price": {
            "amount": 100,
            "currency": "USD"
          },
          "type": "rate",
          "paid_at_checkout": false,
          "description": "base price"
        },
        {
          "price": {
            "amount": 5,
            "currency": "USD"
          },
          "type": "tax",
          "paid_at_checkout": true,
          "description": "city tax"
        }
      ],
      "final_price_at_booking": {
        "amount": 100,
        "currency": "USD"
      },
      "final_price_at_checkout": {
        "amount": 5,
        "currency": "USD"
      }
    }
  },
  "customer_support": {
    "phone_numbers": [
      {
        "contact": "1-153-072-9237 x6907",
        "description": "Tempora iure sit accusamus et cupiditate autem reiciendis iusto."
      }
    ],
    "emails": [
      {
        "contact": "Roxane.McKenzie@gmail.com",
        "description": "Aspernatur reiciendis quis at qui asperiores."
      }
    ],
    "urls": [
      {
        "contact": "http://kasey.info",
        "description": "Maiores enim cupiditate deserunt ut."
      }
    ]
  }
}